{
  "$schema": "../../schema/task.schema.json",
  "id": "FEAT-0041",
  "title": "El reclamo de una tarea rehusa si ya hay rama en el remoto",
  "type": "feature",
  "status": "done",
  "priority": "medium",
  "size": "S",
  "parent": "EPIC-0009",
  "description": "Reclamar una tarea es hoy puramente informativo: dos agentes en dos copias de trabajo pueden reclamar la misma. Comprobar la existencia de la rama en el remoto convierte el reclamo en algo que de verdad excluye.",
  "acceptance_criteria": [
    {
      "id": "AC1",
      "must": "Reclamar rehusa cuando la rama de la tarea ya existe en el remoto y dice quien la tiene",
      "check": {
        "type": "command",
        "run": "node --test tests/tasks.test.mjs"
      },
      "status": "pass",
      "evidence": "reclamar comprueba git ls-remote y rehusa nombrando la rama; --force para forzarlo"
    },
    {
      "id": "AC2",
      "must": "Sin remoto configurado, el reclamo sigue funcionando",
      "check": {
        "type": "command",
        "run": "node --test tests/tasks.test.mjs"
      },
      "status": "pass",
      "evidence": "sin remoto configurado el reclamo sigue funcionando"
    }
  ],
  "context": {
    "area": "cli",
    "docs": [],
    "files": [],
    "out_of_scope": []
  },
  "depends_on": [],
  "blocked_reason": null,
  "labels": [
    "mejora"
  ],
  "assignee": {
    "kind": "agent",
    "id": "implementer"
  },
  "claimed_at": "2026-08-20T16:13:30Z",
  "branch": "feat/0041-el-reclamo-de-una-tarea-rehusa",
  "links": {
    "pr": null,
    "issue": null,
    "commits": []
  },
  "created_at": "2026-08-20T15:30:00Z",
  "updated_at": "2026-08-20T16:13:34Z"
}
