{
  "$schema": "../../schema/task.schema.json",
  "id": "FEAT-0053",
  "title": "Buscar que tareas tocan una ruta",
  "type": "feature",
  "status": "ready",
  "priority": "medium",
  "size": "XS",
  "parent": "EPIC-0012",
  "description": "Analisis de impacto antes de cambiar algo, y forma de ver si dos tareas van a pelearse por los mismos ficheros.",
  "acceptance_criteria": [
    {
      "id": "AC1",
      "must": "Se pueden listar las tareas cuyo contexto o area incluye una ruta dada",
      "check": {
        "type": "command",
        "run": "node --test tests/tasks.test.mjs"
      },
      "status": "pending"
    }
  ],
  "context": {
    "area": "cli",
    "docs": [],
    "files": [],
    "out_of_scope": []
  },
  "depends_on": [],
  "labels": [
    "mejora"
  ],
  "assignee": null,
  "claimed_at": null,
  "branch": null,
  "links": {
    "pr": null,
    "issue": null,
    "commits": []
  },
  "created_at": "2026-08-20T15:30:00Z",
  "updated_at": "2026-08-20T15:30:00Z"
}
