{
  "$schema": "../../schema/task.schema.json",
  "id": "FEAT-0051",
  "title": "La siguiente tarea se elige por camino critico",
  "type": "feature",
  "status": "done",
  "priority": "high",
  "size": "S",
  "parent": "EPIC-0012",
  "description": "La eleccion ordena hoy por prioridad y luego por identificador. Una tarea que desbloquea cinco deberia ganar a una aislada de la misma prioridad, porque eso es literalmente el camino critico.",
  "acceptance_criteria": [
    {
      "id": "AC1",
      "must": "La eleccion tiene en cuenta cuantas tareas desbloquea cada candidata",
      "check": {
        "type": "command",
        "run": "node --test tests/next.test.mjs"
      },
      "status": "pass",
      "baseline": "fail",
      "evidence": "unblockCounts cuenta transitivamente; rankNext lo usa como desempate; tests/next.test.mjs"
    },
    {
      "id": "AC2",
      "must": "La prioridad declarada sigue pesando mas que el desbloqueo",
      "check": {
        "type": "command",
        "run": "node --test tests/next.test.mjs"
      },
      "status": "pass",
      "baseline": "fail",
      "evidence": "una tarea critica aislada sigue ganando a una media que desbloquea cinco"
    }
  ],
  "context": {
    "area": "cli",
    "docs": [],
    "files": [],
    "out_of_scope": []
  },
  "depends_on": [],
  "blocked_reason": null,
  "labels": [
    "mejora"
  ],
  "assignee": {
    "kind": "agent",
    "id": "implementer"
  },
  "claimed_at": "2026-08-20T17:57:53Z",
  "branch": "feat/0051-la-siguiente-tarea-se-elige-por",
  "links": {
    "pr": null,
    "issue": null,
    "commits": []
  },
  "external": {
    "github": {
      "id": "75",
      "url": null,
      "issue": 75,
      "drifted": false,
      "remote_hash": "613c2bdeebc8e451",
      "project_item_id": "PVTI_lAHOAOjmK84Bg-VWzg3XImE",
      "content_hash": "31d6189f89f242dd",
      "last_synced_at": "2026-08-20T18:40:39Z"
    }
  },
  "created_at": "2026-08-20T15:30:00Z",
  "updated_at": "2026-08-21T08:22:07Z"
}
