{
  "$schema": "../../schema/task.schema.json",
  "id": "FEAT-0016",
  "title": "Comandos de revisión y de traspaso",
  "type": "feature",
  "status": "in_review",
  "priority": "high",
  "size": "S",
  "parent": "EPIC-0003",
  "description": "Revisión con veredicto binario y hallazgos localizados, y un traspaso que deja el estado reanudable cuando se acaba el contexto.",
  "acceptance_criteria": [
    {
      "id": "AC1",
      "must": "La revisión emite veredicto binario, sin aprobar con reservas",
      "check": {
        "type": "review",
        "run": null
      },
      "status": "pass",
      "evidence": "commands/review.md: approve o changes_requested"
    },
    {
      "id": "AC2",
      "must": "El traspaso registra la etapa alcanzada sin optimismo",
      "check": {
        "type": "review",
        "run": null
      },
      "status": "pass",
      "evidence": "commands/handoff.md: regla de etapa conservadora"
    }
  ],
  "context": {
    "area": "definitions",
    "docs": [],
    "files": [],
    "out_of_scope": []
  },
  "depends_on": [],
  "labels": [],
  "assignee": {
    "kind": "agent",
    "id": "implementer"
  },
  "claimed_at": "2026-08-18T19:00:00Z",
  "branch": null,
  "links": {
    "pr": null,
    "issue": null,
    "commits": []
  },
  "created_at": "2026-08-18T19:00:00Z",
  "updated_at": "2026-08-18T19:00:00Z"
}
