{
  "$schema": "../../schema/task.schema.json",
  "id": "FEAT-0045",
  "title": "Detectar ficheros generados que ya no tienen fuente",
  "type": "feature",
  "status": "in_progress",
  "priority": "medium",
  "size": "S",
  "parent": "EPIC-0010",
  "description": "Al renombrar un agente, su fichero generado antiguo se queda para siempre en el directorio del proveedor. La generacion no borra y el autodiagnostico no lo ve, asi que un agente fantasma sigue disponible para el proveedor. Lo documente como trampa conocida en lugar de arreglarlo.",
  "acceptance_criteria": [
    {
      "id": "AC1",
      "must": "El autodiagnostico detecta ficheros generados sin definicion canonica que los respalde",
      "check": {
        "type": "command",
        "run": "node --test tests/orphans.test.mjs"
      },
      "status": "pass",
      "baseline": "not-run",
      "evidence": "doctor --only orphans detecta el generado sin fuente; verificado con un fichero fantasma real"
    },
    {
      "id": "AC2",
      "must": "La reparacion automatica los elimina, y solo a ellos",
      "check": {
        "type": "command",
        "run": "node --test tests/orphans.test.mjs"
      },
      "status": "pass",
      "baseline": "not-run"
    }
  ],
  "context": {
    "area": "adapters",
    "docs": [],
    "files": [],
    "out_of_scope": []
  },
  "depends_on": [],
  "labels": [
    "mejora"
  ],
  "assignee": {
    "kind": "agent",
    "id": "implementer"
  },
  "claimed_at": "2026-08-20T17:53:14Z",
  "branch": "feat/0045-detectar-ficheros-generados-que-ya-no",
  "links": {
    "pr": null,
    "issue": null,
    "commits": []
  },
  "created_at": "2026-08-20T15:30:00Z",
  "updated_at": "2026-08-20T17:53:16Z"
}
