{
  "$schema": "../../schema/task.schema.json",
  "id": "EPIC-0012",
  "title": "Ergonomia y huecos del dia a dia",
  "type": "epic",
  "status": "ready",
  "priority": "high",
  "description": "Lo que hace que el harness se use en lugar de rodearse.",
  "acceptance_criteria": [
    {
      "id": "AC1",
      "must": "Todas las tareas hijas están en done.",
      "check": {
        "type": "review",
        "run": null
      },
      "status": "pending"
    }
  ],
  "context": {
    "area": null,
    "docs": [
      "docs/HARNESS-PLAN.md"
    ],
    "files": [],
    "out_of_scope": []
  },
  "depends_on": [],
  "labels": [
    "fase",
    "mejora"
  ],
  "assignee": null,
  "claimed_at": null,
  "branch": null,
  "links": {
    "pr": null,
    "issue": null,
    "commits": []
  },
  "created_at": "2026-08-20T15:30:00Z",
  "updated_at": "2026-08-20T15:30:00Z"
}
