{
  "$schema": "../../schema/task.schema.json",
  "id": "EPIC-0003",
  "title": "Agentes, comandos y proyección a Claude Code",
  "type": "epic",
  "status": "done",
  "priority": "high",
  "description": "El ciclo completo de una tarea, de idea a solicitud de cambios, ejecutado sobre el propio backlog.",
  "acceptance_criteria": [
    {
      "id": "AC1",
      "must": "Todas las tareas hijas están en done.",
      "check": {
        "type": "review",
        "run": null
      },
      "status": "pending"
    }
  ],
  "context": {
    "area": null,
    "docs": [
      "docs/HARNESS-PLAN.md"
    ],
    "files": [],
    "out_of_scope": []
  },
  "depends_on": [],
  "blocked_reason": null,
  "labels": [
    "fase"
  ],
  "assignee": null,
  "claimed_at": null,
  "branch": null,
  "links": {
    "pr": null,
    "issue": null,
    "commits": []
  },
  "external": {
    "github": {
      "id": "14",
      "url": null,
      "issue": 14,
      "drifted": false,
      "content_hash": "0cdff8d15e5ba0ff",
      "last_synced_at": "2026-08-20T16:33:29Z"
    }
  },
  "created_at": "2026-08-18T19:00:00Z",
  "updated_at": "2026-08-20T16:33:29Z"
}
