{
  "$schema": "../../schema/task.schema.json",
  "id": "SPIKE-0001",
  "title": "Verificar los formatos reales de Cursor y de Copilot",
  "type": "spike",
  "status": "in_review",
  "priority": "low",
  "size": "S",
  "parent": "EPIC-0005",
  "description": "Antes de escribir esos adaptadores hay que confirmar su sintaxis contra la documentación oficial. Un adaptador construido sobre sintaxis recordada a medias es peor que no tener adaptador.",
  "acceptance_criteria": [
    {
      "id": "AC1",
      "must": "La sintaxis queda confirmada contra documentación oficial, sin nada inventado",
      "check": {
        "type": "review",
        "run": null
      },
      "status": "pass",
      "evidence": "Cursor: .cursor/rules/*.mdc con tres campos de front-matter (description, globs, alwaysApply), cuatro modos de aplicacion, referencias con @fichero. Fuente https://cursor.com/docs/rules. Copilot: .github/copilot-instructions.md para todo el repo y .github/instructions/NOMBRE.instructions.md con applyTo (y excludeAgent opcional), solo en el agente en la nube y la revision de codigo; ademas lee AGENTS.md. Fuente https://docs.github.com/en/copilot/how-tos/configure-custom-instructions/add-repository-instructions. Recogido en docs/PROVIDERS.md, con .cursorrules marcado SIN VERIFICAR porque la documentacion ya no lo menciona y eso no equivale a estar retirado."
    }
  ],
  "context": {
    "area": "adapters",
    "docs": [],
    "files": [],
    "out_of_scope": []
  },
  "depends_on": [],
  "blocked_reason": null,
  "labels": [],
  "assignee": {
    "kind": "agent",
    "id": "researcher"
  },
  "claimed_at": "2026-08-21T08:55:17Z",
  "branch": "spike/0001-verificar-los-formatos-reales-de-cursor",
  "links": {
    "pr": "https://github.com/antoniopaya22/project-agent-harness/pull/103",
    "issue": null,
    "commits": [
      "133e1b0027cc"
    ]
  },
  "external": {
    "github": {
      "id": "86",
      "url": null,
      "issue": 86,
      "drifted": false,
      "remote_hash": "74748a64af075878",
      "project_item_id": "PVTI_lAHOAOjmK84Bg-VWzg3XJBs",
      "content_hash": "c4d3501e6cd3851b",
      "last_synced_at": "2026-08-20T18:41:47Z"
    }
  },
  "created_at": "2026-08-18T19:00:00Z",
  "updated_at": "2026-08-21T08:56:14Z"
}
