{
  "$schema": "../../schema/task.schema.json",
  "id": "EPIC-0001",
  "title": "Cimientos: esquemas, entrada en frío y set documental",
  "type": "epic",
  "status": "done",
  "priority": "critical",
  "description": "Un agente puede implementar una tarea creada a mano leyendo cuatro ficheros.",
  "acceptance_criteria": [
    {
      "id": "AC1",
      "must": "Todas las tareas hijas están en done.",
      "check": {
        "type": "review",
        "run": null
      },
      "status": "pending"
    }
  ],
  "context": {
    "area": null,
    "docs": [
      "docs/HARNESS-PLAN.md"
    ],
    "files": [],
    "out_of_scope": []
  },
  "depends_on": [],
  "blocked_reason": null,
  "labels": [
    "fase"
  ],
  "assignee": null,
  "claimed_at": null,
  "branch": null,
  "links": {
    "pr": null,
    "issue": null,
    "commits": []
  },
  "created_at": "2026-08-18T19:00:00Z",
  "updated_at": "2026-08-20T16:01:17Z"
}
