{
  "$schema": "../../schema/task.schema.json",
  "id": "FEAT-0040",
  "title": "Gate de secretos sobre el cambio completo",
  "type": "feature",
  "status": "done",
  "priority": "high",
  "size": "S",
  "parent": "EPIC-0009",
  "description": "El autodiagnostico busca credenciales en los ficheros de tarea y en la configuracion. Un token puede entrar por cualquier fichero, y el momento de detectarlo es antes de commitear, no despues.",
  "acceptance_criteria": [
    {
      "id": "AC1",
      "must": "El commit rehusa cuando el cambio contiene algo con forma de credencial",
      "check": {
        "type": "command",
        "run": "node --test tests/secrets.test.mjs"
      },
      "status": "pass",
      "evidence": "el commit escanea solo las lineas anadidas del diff staged y rehusa; 6 tests en tests/secrets.test.mjs"
    },
    {
      "id": "AC2",
      "must": "Existe forma explicita y registrada de saltarse la comprobacion ante un falso positivo",
      "check": {
        "type": "command",
        "run": "node --test tests/secrets.test.mjs"
      },
      "status": "pass"
    }
  ],
  "context": {
    "area": "cli",
    "docs": [],
    "files": [],
    "out_of_scope": []
  },
  "depends_on": [],
  "blocked_reason": null,
  "labels": [
    "mejora"
  ],
  "assignee": {
    "kind": "agent",
    "id": "implementer"
  },
  "claimed_at": "2026-08-20T16:13:29Z",
  "branch": "feat/0040-gate-de-secretos-sobre-el-cambio",
  "links": {
    "pr": null,
    "issue": null,
    "commits": []
  },
  "external": {
    "github": {
      "id": "64",
      "url": null,
      "issue": 64,
      "drifted": false,
      "remote_hash": "f1ce9362b32cb777",
      "project_item_id": "PVTI_lAHOAOjmK84Bg-VWzg3XIIw",
      "content_hash": "a47c95b4f13bc673",
      "last_synced_at": "2026-08-20T18:39:29Z"
    }
  },
  "created_at": "2026-08-20T15:30:00Z",
  "updated_at": "2026-08-20T18:39:29Z"
}
