{
  "$schema": "../../schema/task.schema.json",
  "id": "FEAT-0039",
  "title": "Bloquear la edicion de ficheros generados con automatismos del proveedor",
  "type": "feature",
  "status": "in_review",
  "priority": "high",
  "size": "M",
  "parent": "EPIC-0009",
  "description": "La prohibicion de editar un fichero generado esta escrita en tres sitios y no la impide nada. Donde el proveedor ofrece automatismos ante eventos, la regla puede pasar de recordatorio a mecanismo.",
  "acceptance_criteria": [
    {
      "id": "AC1",
      "must": "Intentar editar un fichero con cabecera de generado queda bloqueado",
      "check": {
        "type": "manual",
        "run": null
      },
      "status": "pass",
      "evidence": "exit 2 y veredicto deny al editar un fichero generado, con el mensaje diciendo donde esta la fuente real. tests/hooks.test.mjs caso 1."
    },
    {
      "id": "AC2",
      "must": "Editar un fichero de tarea dispara la validacion de esquema",
      "check": {
        "type": "manual",
        "run": null
      },
      "status": "pass",
      "evidence": "PostToolUse sobre un fichero de tarea valida contra el esquema e informa sin arreglar. tests/hooks.test.mjs casos 8 y 9."
    },
    {
      "id": "AC3",
      "must": "Los automatismos se generan desde la configuracion y editar un fichero generado queda bloqueado en la practica",
      "check": {
        "type": "manual",
        "run": null
      },
      "status": "pass",
      "baseline": "pass",
      "evidence": "Los hooks se generan desde project.json (seccion hooks) a .claude/settings.json; el guard bloquea los 29 ficheros que devuelve plan(ctx). Verificado invocando el guard directamente: tests/hooks.test.mjs casos 1, 10 y 11, y tests/generate.test.mjs 'the guard blocks every path generate would overwrite'. NO verificado: que Claude Code cargue el hook en vivo, porque los settings se leen al arrancar la sesion y este fichero se acaba de crear."
    }
  ],
  "context": {
    "area": "adapters",
    "docs": [],
    "files": [],
    "out_of_scope": []
  },
  "depends_on": [],
  "labels": [
    "mejora"
  ],
  "assignee": {
    "kind": "agent",
    "id": "implementer"
  },
  "claimed_at": "2026-08-21T08:44:33Z",
  "branch": "feat/0039-bloquear-la-edicion-de-ficheros-generados",
  "links": {
    "pr": "https://github.com/antoniopaya22/project-agent-harness/pull/102",
    "issue": null,
    "commits": [
      "ebd7cea64ddd"
    ]
  },
  "external": {
    "github": {
      "id": "63",
      "url": null,
      "issue": 63,
      "drifted": false,
      "remote_hash": "298f6e7d8e4a6e81",
      "project_item_id": "PVTI_lAHOAOjmK84Bg-VWzg3XIGU",
      "content_hash": "a1cf73567d3b9a37",
      "last_synced_at": "2026-08-20T18:39:22Z"
    }
  },
  "created_at": "2026-08-20T15:30:00Z",
  "updated_at": "2026-08-21T08:48:53Z"
}
