{
  "$schema": "../../schema/task.schema.json",
  "id": "EPIC-0009",
  "title": "Mecanismos en lugar de instrucciones",
  "type": "epic",
  "status": "ready",
  "priority": "critical",
  "description": "Cada vez que un prompt dice \"fijate en X\" hay una oportunidad de convertirlo en un codigo de salida. Lo que depende de que un modelo se acuerde, tarde o temprano falla.",
  "acceptance_criteria": [
    {
      "id": "AC1",
      "must": "Todas las tareas hijas están en done.",
      "check": {
        "type": "review",
        "run": null
      },
      "status": "pending"
    }
  ],
  "context": {
    "area": null,
    "docs": [
      "docs/HARNESS-PLAN.md"
    ],
    "files": [],
    "out_of_scope": []
  },
  "depends_on": [],
  "labels": [
    "fase",
    "mejora"
  ],
  "assignee": null,
  "claimed_at": null,
  "branch": null,
  "links": {
    "pr": null,
    "issue": null,
    "commits": []
  },
  "external": {
    "github": {
      "id": "20",
      "url": null,
      "issue": 20,
      "drifted": false,
      "content_hash": "96476157f9e33afb",
      "last_synced_at": "2026-08-20T20:04:59Z",
      "remote_hash": "35574c419eb4e83b",
      "project_item_id": "PVTI_lAHOAOjmK84Bg-VWzg3Xxbo"
    }
  },
  "created_at": "2026-08-20T15:30:00Z",
  "updated_at": "2026-08-20T20:04:59Z"
}
