{
  "$schema": "../../schema/task.schema.json",
  "id": "CHORE-0004",
  "title": "Autopruebas e integración continua",
  "type": "chore",
  "status": "in_review",
  "priority": "high",
  "size": "M",
  "parent": "EPIC-0007",
  "description": "Cómo sabemos que el harness funciona: pruebas de esquema con casos válidos e inválidos, comparación contra salida esperada del generador, y la prueba que hace cumplir los presupuestos del camino de lectura.",
  "acceptance_criteria": [
    {
      "id": "AC1",
      "must": "Las autopruebas cubren esquema, generación, tareas, gates y camino de lectura",
      "check": {
        "type": "command",
        "run": "node --test \"tests/*.test.mjs\""
      },
      "status": "pass",
      "evidence": "Nueve ficheros de prueba en verde"
    },
    {
      "id": "AC2",
      "must": "La integración continua ejecuta el autodiagnóstico y las autopruebas",
      "check": {
        "type": "review",
        "run": null
      },
      "status": "pass",
      "evidence": ".github/workflows/harness.yml"
    }
  ],
  "context": {
    "area": "cli",
    "docs": [],
    "files": [],
    "out_of_scope": []
  },
  "depends_on": [],
  "labels": [],
  "assignee": {
    "kind": "agent",
    "id": "implementer"
  },
  "claimed_at": "2026-08-18T19:00:00Z",
  "branch": null,
  "links": {
    "pr": null,
    "issue": null,
    "commits": []
  },
  "created_at": "2026-08-18T19:00:00Z",
  "updated_at": "2026-08-18T19:00:00Z"
}
