{
  "$schema": "../../schema/task.schema.json",
  "id": "RFCT-0002",
  "title": "Los comandos referencian a los agentes en vez de reescribirlos",
  "type": "refactor",
  "status": "done",
  "priority": "high",
  "size": "M",
  "parent": "EPIC-0008",
  "description": "La definicion del comando de verificacion repite media definicion del rol verificador, y lo mismo pasa en varios mas. Es duplicacion de tokens en cada invocacion y, peor, dos sitios que se van a desincronizar. El generador deberia poder incluir un bloque compartido en lugar de que cada fichero lo copie.",
  "acceptance_criteria": [
    {
      "id": "AC1",
      "must": "El generador resuelve inclusiones de bloques compartidos",
      "check": {
        "type": "command",
        "run": "node --test tests/generate.test.mjs"
      },
      "status": "pass",
      "evidence": "resolveTemplates resuelve {{include:}} y {{config:}} al cargar cada definicion"
    },
    {
      "id": "AC2",
      "must": "Las reglas duras y los limites de cada rol se declaran una vez y se incluyen donde hagan falta",
      "check": {
        "type": "command",
        "run": "node .harness/bin/harness.mjs generate --check"
      },
      "status": "pass",
      "evidence": "includes/never-fake-green.md escrito una vez; doctor falla si una plantilla queda sin resolver"
    },
    {
      "id": "AC3",
      "must": "Ninguna definicion de comando repite el procedimiento de un rol",
      "check": {
        "type": "review",
        "run": null
      },
      "status": "pass",
      "evidence": "verify.md ya no reescribe el procedimiento del tester, lo referencia"
    }
  ],
  "context": {
    "area": "definitions",
    "docs": [],
    "files": [],
    "out_of_scope": []
  },
  "depends_on": [],
  "blocked_reason": null,
  "labels": [
    "mejora"
  ],
  "assignee": {
    "kind": "agent",
    "id": "implementer"
  },
  "claimed_at": "2026-08-20T16:13:32Z",
  "branch": "refactor/0002-los-comandos-referencian-a-los-agentes",
  "links": {
    "pr": null,
    "issue": null,
    "commits": []
  },
  "created_at": "2026-08-20T15:30:00Z",
  "updated_at": "2026-08-20T16:13:34Z"
}
